<?xml version="1.0" encoding="UTF-8"?>
<tns:poll xmlns:tns="http://doodle.com/xsd1" xmlns:xsi="http://www.w3.org/2001/XMLSchema-instance" xsi:schemaLocation="http://doodle.com/xsd1 poll.xsd ">
  <tns:latestChange>2001-12-31T12:00:00</tns:latestChange>
  <tns:type>DATE</tns:type>
  <tns:extensions columnConstraint="0" rowConstraint="0" timeZone="true"/>
  <tns:hidden>true</tns:hidden>
  <tns:writeOnce>true</tns:writeOnce>
  <tns:requireAddress>true</tns:requireAddress>
  <tns:requireEMail>true</tns:requireEMail>
  <tns:requirePhone>true</tns:requirePhone>
  <tns:byInvitationOnly nrOfInvitees="0">true</tns:byInvitationOnly>
  <tns:levels>0</tns:levels>
  <tns:state>OPEN</tns:state>
  <tns:language>aa</tns:language>
  <tns:title>tns:title</tns:title>
  <tns:location>tns:location</tns:location>
  <tns:description>tns:description</tns:description>
  <tns:initiator>
    <tns:name>tns:name</tns:name>
    <tns:userId>tns:userId</tns:userId>
    <tns:eMailAddress>tns:eMailAddress</tns:eMailAddress>
  </tns:initiator>
  <tns:options>
    <tns:option date="2001-01-01" dateTime="2001-12-31T12:00:00" endDateTime="2001-12-31T12:00:00" final="true" startDateTime="2001-12-31T12:00:00">tns:option</tns:option>
  </tns:options>
  <tns:participants nrOf="0">
    <tns:participant>tns:participant</tns:participant>
  </tns:participants>
  <tns:comments nrOf="0">
    <tns:comment>tns:comment</tns:comment>
  </tns:comments>
  <tns:mandator>0</tns:mandator>
  <tns:features>tns:features</tns:features>
</tns:poll>
